<?xml version="1.0" encoding="UTF-8"?>
<!-- Grupo 05  -->
<!--Enlazar archivo xsd-->
<registro xmlns:xsi="http://www.w3.org/2001/XMLSchema-instance" xsi:noNamespaceSchemaLocation="registrofacturasgrupo05.xsd" periodo="2012-03">
    <responsable>Lic. Inocencio Pérez</responsable>

    <!--Factura 1 -->
    <factura tipo="final">
        <num>564</num>

        <cliente codigo="2617" sexo="femenino">
            <nombre>María Vélez</nombre>
            <documento>
                <dui vence="2018-03-03">02349867-9</dui>
            </documento>
            <telefono tipo="fijo">24356789</telefono>
            <email>mariav@gmail.com</email>
        </cliente>

        <direccion depto="San Salvador" municipio="San Salvador">
            <casa>Prados del Bosque Num.23</casa>
        </direccion>

        <lineafactura factura="564">
            <codigo tipo="souvenir">498</codigo>
            <detalle>Llavero estampas de mi pueblo: Izalco</detalle>
            <cantidad>10</cantidad>

            <precio>
                <moneda>$</moneda>
                <valor>1.13</valor>
            </precio>

            <subtotal>
                <moneda>$</moneda>
                <valor>11.30</valor>
            </subtotal>

        </lineafactura>

        <total>
            <moneda>$</moneda>
            <valor>11.30</valor>
        </total>
    </factura>

    <!--Factura 2 -->
    <factura tipo="credito">
        <num>570</num>
        <cliente codigo="5032" sexo="femenino">
            <nombre>Julia Pérez</nombre>
            <documento>
                <pasaporte pais="USA">A98672340</pasaporte> <!--Atributo simple-->
            </documento>
            <telefono tipo="celular" cia="tigo">78354926</telefono>
            <email>jperez@sica.com</email>
        </cliente>
        <direccion depto="La Libertad" municipio="Antiguo Cuscatlan">
            <oficina>5 Av. Sur</oficina>
        </direccion>
        <lineafactura factura="570">
            <codigo tipo="pcportatiles">734</codigo>
            <detalle>netbook acer a240</detalle>
            <cantidad>3</cantidad>
            <precio>
                <moneda>$</moneda>
                <valor>350.00</valor>
            </precio>
            <subtotal>
                <moneda>$</moneda>
                <valor>1050.00</valor>
            </subtotal>
        </lineafactura>
        <total>
            <moneda>$</moneda>
            <valor>1050.00</valor>
        </total>
    </factura>

    <!--factura 3-->
    <factura tipo="credito">
        <num>575</num>
        <cliente codigo="5327" sexo="masculino">
            <nombre>Jhon Smith</nombre>
            <documento>
                <pasaporte pais="USA">A98670234</pasaporte>
            </documento>
            <telefono tipo="celular" cia="tigo">78923546</telefono>
            <email>jsmith@usaid.com</email>
        </cliente>
        <direccion depto="La Libertad" municipio="Santa Tecla">
            <oficina>Final 25 Av. Norte</oficina>
        </direccion>
        <lineafactura factura="575">
            <codigo tipo="accesorio_pc">247</codigo>
            <detalle>Mouse inalámbrico</detalle>
            <cantidad>5</cantidad>
            <precio>
                <moneda>$</moneda>
                <valor>10.00</valor>
            </precio>
            <subtotal>
                <moneda>$</moneda>
                <valor>50.00</valor>
            </subtotal>
        </lineafactura>
        <total>
            <moneda>$</moneda>
            <valor>50.00</valor>
        </total>
    </factura>

    <!--factura 4 -->
    <factura tipo="final">
        <num>590</num>
        <cliente codigo="617" sexo="masculino">
            <nombre>Juan Pérez</nombre>
            <documento>
                <pasaporte pais="SLV">A40298367</pasaporte>
            </documento>
            <telefono tipo="celular" cia="claro">76023546</telefono>
            <email>jperez@gmail.com</email>
        </cliente>
        <lineafactura factura="590">
            <codigo tipo="perecedero">213</codigo>
            <detalle>Agua embotellada</detalle>
            <cantidad>10</cantidad>
            <precio>
                <moneda>$</moneda>
                <valor>0.50</valor>
            </precio>
            <subtotal>
                <moneda>$</moneda>
                <valor>5.00</valor>
            </subtotal>
        </lineafactura>
        <total>
            <moneda>$</moneda>
            <valor>5.00</valor>
        </total>
    </factura>

    <!--factura 5-->
    <factura tipo="final">
        <num>593</num>
        <cliente codigo="177" sexo="masculino">
            <nombre>Pedro Portillo</nombre>
            <documento>
                <pasaporte pais="SLV">A43698027</pasaporte>
            </documento>
            <telefono tipo="celular" cia="claro">76028642</telefono>
            <email>pportillo@hotmail.com</email>
        </cliente>
        <lineafactura factura="593">
            <codigo tipo="perecedero">215</codigo>
            <detalle>Soda enlatada</detalle>
            <cantidad>24</cantidad>
            <precio>
                <moneda>$</moneda>
                <valor>0.50</valor>
            </precio>
            <subtotal>
                <moneda>$</moneda>
                <valor>5.00</valor>
            </subtotal>
        </lineafactura>
        <total>
            <moneda>$</moneda>
            <valor>5.00</valor>
        </total>
    </factura>

    <!--factura 6 -->
    <factura tipo="credito">
        <num>585</num>
        <cliente codigo="5327" sexo="masculino">
            <nombre>Jhon Smith</nombre>
            <documento>
                <dui vence="2018-06-03">02810867-0</dui>
            </documento>
            <telefono tipo="celular" cia="tigo">78923546</telefono>
            <email>jsmith@usaid.com</email>
        </cliente>
        <direccion depto="La Libertad" municipio="Santa Tecla">
            <oficina>Final 25 Av. Norte</oficina>
        </direccion>
        <lineafactura factura="575">
            <codigo tipo="accesorio_pc">247</codigo>
            <detalle>Mouse inalambrico</detalle>
            <cantidad>10</cantidad>
            <precio>
                <moneda>$</moneda>
                <valor>10.00</valor>
            </precio>
            <subtotal>
                <moneda>$</moneda>
                <valor>100.00</valor>
            </subtotal>
        </lineafactura>
        <total>
            <moneda>$</moneda>
            <valor>100.00</valor>
        </total>
    </factura>

    <!--Agregar las 4 facturas faltantes-->

    <!--factura 7 -->

    <factura tipo="final">
        <num>264</num>
        <cliente codigo="0867" sexo="masculino">
            <nombre>Julio Josè</nombre>
            <documento>
                <dui vence="2019-09-12">09870904-2</dui>
            </documento>
            <telefono tipo="celular" cia="claro">76982148</telefono>
            <email>juljos@gmail.com</email>
        </cliente>
        <direccion depto="La Libertad" municipio="Santa Tecla">
            <oficina>2a Av. Norte</oficina>
        </direccion>
        <lineafactura factura="139">
            <codigo tipo="perecedero">352</codigo>
            <detalle>Carne de res</detalle>
            <cantidad>2</cantidad>
            <precio>
                <moneda>$</moneda>
                <valor>4.15</valor>
            </precio>
            <subtotal>
                <moneda>$</moneda>
                <valor>8.30</valor>
            </subtotal>
        </lineafactura>
        <total>
            <moneda>$</moneda>
            <valor>8.30</valor>
        </total>
    </factura>


    <!--factura 8-->
    <factura tipo="final">
        <num>352</num>
        <cliente codigo="125" sexo="femenino">
            <nombre>Celeste Lopèz</nombre>
            <documento>
                <pasaporte pais="HND">C28792473</pasaporte>
            </documento>
            <telefono tipo="celular" cia="movistar">73209745</telefono>
            <email>cello@hotmail.com</email>
        </cliente>
        <lineafactura factura="209">
            <codigo tipo="accesorio_pc">654</codigo>
            <detalle>Teclado para PC</detalle>
            <cantidad>2</cantidad>
            <precio>
                <moneda>$</moneda>
                <valor>35.00</valor>
            </precio>
            <subtotal>
                <moneda>$</moneda>
                <valor>70.00</valor>
            </subtotal>
        </lineafactura>
        <total>
            <moneda>$</moneda>
            <valor>70.00</valor>
        </total>
    </factura>
    <!-- FACTURA 9-->
    <factura tipo="credito">
        <num>102</num>
        <cliente codigo="2753" sexo="femenino">
            <nombre>Monet Lott</nombre>
            <documento>
                <dui vence="2002-10-12">56457436-1</dui>
            </documento>
            <telefono tipo="celular">78952165</telefono>
            <email>mlott@email.com</email>
        </cliente>
        <direccion depto="Usulutan" municipio="Berlin">
            <oficina>Final 24 Av. Sur</oficina>
        </direccion>
        <lineafactura factura="650">
            <codigo tipo="accesorio_pc">580</codigo>
            <detalle>Procesador Ryzon</detalle>
            <cantidad>1</cantidad>
            <precio>
                <moneda>$</moneda>
                <valor>450</valor>
            </precio>
            <subtotal>
                <moneda>$</moneda>
                <valor>450</valor>
            </subtotal>
        </lineafactura>
        <total>
            <moneda>$</moneda>
            <valor>450</valor>
        </total>
    </factura>

    <!-- FACTURA 10-->

    <factura tipo="credito">
        <num>031</num>
        <cliente codigo="2156" sexo="masculino">
            <nombre>Adam Zapel</nombre>
            <documento>
                <dui vence="2012-11-25">65147852-5</dui>
            </documento>
            <telefono tipo="celular">66425485</telefono>